{
  "$schema": "https://json-schema.org/draft/2020-12/schema",
  "$id": "https://danyanpihuihui.github.io/organa-cell-7187/versions/0.3.0/schemas/organa-cell-resolution-v0.1.schema.json",
  "title": "Organa Cell Resolution Manifest v0.1",
  "type": "object",
  "required": [
    "schema_version",
    "coordinate",
    "cell_type",
    "version",
    "created_at_utc",
    "lifecycle_status",
    "controller",
    "public_base_url",
    "resources",
    "agents",
    "services"
  ],
  "properties": {
    "schema_version": {
      "const": "organa-cell-resolution-v0.1"
    },
    "coordinate": {
      "type": "string",
      "pattern": "^[0-9]+\\.bitmap$"
    },
    "cell_type": {
      "const": "organa-cell"
    },
    "title": {
      "type": "string",
      "minLength": 1
    },
    "version": {
      "type": "string",
      "pattern": "^[0-9]+\\.[0-9]+\\.[0-9]+"
    },
    "created_at_utc": {
      "type": "string",
      "format": "date-time"
    },
    "lifecycle_status": {
      "enum": [
        "live",
        "simulation",
        "pending",
        "deprecated"
      ]
    },
    "activation_status": {
      "enum": [
        "awaiting-controller-signature",
        "active",
        "deprecated"
      ]
    },
    "state_semantics": {
      "type": "object",
      "required": [
        "lifecycle_status",
        "activation_status",
        "controller_signature_status",
        "canonical_state_source"
      ],
      "properties": {
        "lifecycle_status": {
          "const": "declared object lifecycle"
        },
        "activation_status": {
          "const": "canonical publication activation"
        },
        "controller_signature_status": {
          "const": "controller authentication state"
        },
        "canonical_state_source": {
          "const": ".well-known/organa.json"
        }
      },
      "additionalProperties": false
    },
    "status_note": {
      "type": "string"
    },
    "previous_manifest": {
      "type": "object",
      "required": [
        "url",
        "sha256",
        "version"
      ],
      "properties": {
        "url": {
          "type": "string",
          "pattern": "^https://"
        },
        "sha256": {
          "type": "string",
          "pattern": "^sha256:[0-9a-f]{64}$"
        },
        "version": {
          "type": "string",
          "pattern": "^[0-9]+\\.[0-9]+\\.[0-9]+"
        }
      },
      "additionalProperties": false
    },
    "controller": {
      "type": "object",
      "required": [
        "address",
        "claim_type",
        "signature_status",
        "signature_request_url"
      ],
      "properties": {
        "address": {
          "type": "string",
          "minLength": 14,
          "maxLength": 90
        },
        "claim_type": {
          "const": "bitmap-controller-wallet-claim"
        },
        "signature_status": {
          "enum": [
            "pending-user-signature",
            "signed",
            "invalid",
            "deprecated"
          ]
        },
        "signature_request_url": {
          "type": "string",
          "pattern": "^https://"
        }
      },
      "additionalProperties": false
    },
    "public_base_url": {
      "type": "string",
      "pattern": "^https://"
    },
    "resources": {
      "type": "array",
      "minItems": 6,
      "items": {
        "type": "object",
        "required": [
          "path",
          "url",
          "sha256"
        ],
        "properties": {
          "path": {
            "type": "string",
            "minLength": 1
          },
          "url": {
            "type": "string",
            "format": "uri",
            "pattern": "^https://"
          },
          "sha256": {
            "type": "string",
            "pattern": "^sha256:[0-9a-f]{64}$"
          }
        },
        "additionalProperties": false
      }
    },
    "agents": {
      "type": "array",
      "minItems": 1
    },
    "services": {
      "type": "array",
      "minItems": 1
    },
    "disclosure_policy_url": {
      "type": "string",
      "pattern": "^https://"
    },
    "proof_index_url": {
      "type": "string",
      "pattern": "^https://"
    },
    "machine_instructions": {
      "type": "array",
      "items": {
        "type": "string"
      }
    }
  },
  "additionalProperties": false
}
